{
  "schema_version": 1,
  "registry_id": "tmxy-core-table-registry-v1",
  "task_id": "P2-07",
  "status": "authoritative-frozen-build-import-contract",
  "source_build": "qy-3.0.0.413",
  "scope": {
    "table_count": 12,
    "authority": "frozen-source-build-import-only",
    "future_change_policy": "schema-version-bump-and-full-revalidation"
  },
  "source": {
    "p2_06_evidence_path": "Data/Inventory/p2-06-three-layer-data.json",
    "p2_06_evidence_sha256": "c399bfc3db6c516be3165750de96f705452c631e14c6ae10530325ea576ef876",
    "p2_06_content_set_sha256": "920df393da83b12e8255db0015eb6ad4c6fdfbbe29698e6d0ea284c7ab24ea4d",
    "policy_path": "Contracts/data-schema/core-table-policy-v1.json",
    "policy_sha256": "78e91a0ffc1085aa9f14f5f47ac232ddd33b33dfe1c479aad3e949e270b7a09c",
    "contract_path": "Contracts/data-schema/core-table-registry-v1.schema.json",
    "contract_sha256": "ce9798290148d2cc3cb595138e2534a908ee862d305e7ec499de06e95f156b7b"
  },
  "summary": {
    "tables": 12,
    "physical_rows": 87844,
    "canonical_rows": 87044,
    "columns": 355,
    "columns_with_type_and_rule": 355,
    "primary_keys": 12,
    "foreign_keys": 14,
    "active_reference_rows": 55361,
    "inactive_reference_rows": 129154,
    "duplicate_occurrences_collapsed": 800,
    "type_violations": 0,
    "range_violations": 0,
    "key_violations": 0,
    "dangling_references": 0,
    "result": "PASS"
  },
  "tables": [
    {
      "source_path": "CLSVShare/item_table.tbl",
      "logical_name": "CLSVShare/item_table",
      "role": "item-definition",
      "source_schema_sha256": "daea1521be5374aed43fe8b05a5d7856fe7fc210ab0ebe3dd71db9bcf8f4723c",
      "normalized_sha256": "3e8e71e55fe03a89a913b551da8f8960ec6ab7aac28d7508dfe582825058b319",
      "physical_rows": 29223,
      "canonical_rows": 29223,
      "primary_key": {
        "column_ids": [
          "c0001"
        ],
        "duplicate_policy": "reject",
        "null_violations": 0,
        "duplicate_groups": 0,
        "duplicate_occurrences": 0,
        "divergent_duplicate_groups": 0,
        "result": "PASS"
      },
      "columns": [
        {
          "id": "c0001",
          "source_ordinal": 1,
          "source_name": "guid",
          "type": "int64",
          "nullable": false,
          "null_count": 0,
          "non_null_count": 29223,
          "type_violations": 0,
          "range_violations": 0,
          "bounds": {
            "kind": "numeric-inclusive",
            "minimum": 50,
            "maximum": 65535
          },
          "change_policy": "schema-version-bump-and-full-revalidation"
        },
        {
          "id": "c0002",
          "source_ordinal": 2,
          "source_name": "name",
          "type": "string",
          "nullable": false,
          "null_count": 0,
          "non_null_count": 29223,
          "type_violations": 0,
          "range_violations": 0,
          "bounds": {
            "kind": "utf8-byte-length-inclusive",
            "minimum_utf8_bytes": 3,
            "maximum_utf8_bytes": 66
          },
          "change_policy": "schema-version-bump-and-full-revalidation"
        },
        {
          "id": "c0003",
          "source_ordinal": 3,
          "source_name": "describe",
          "type": "string",
          "nullable": true,
          "null_count": 3551,
          "non_null_count": 25672,
          "type_violations": 0,
          "range_violations": 0,
          "bounds": {
            "kind": "utf8-byte-length-inclusive",
            "minimum_utf8_bytes": 3,
            "maximum_utf8_bytes": 702
          },
          "change_policy": "schema-version-bump-and-full-revalidation"
        },
        {
          "id": "c0004",
          "source_ordinal": 4,
          "source_name": "subclass",
          "type": "string",
          "nullable": false,
          "null_count": 0,
          "non_null_count": 29223,
          "type_violations": 0,
          "range_violations": 0,
          "bounds": {
            "kind": "utf8-byte-length-inclusive",
            "minimum_utf8_bytes": 6,
            "maximum_utf8_bytes": 28
          },
          "change_policy": "schema-version-bump-and-full-revalidation"
        },
        {
          "id": "c0005",
          "source_ordinal": 5,
          "source_name": "level",
          "type": "int64",
          "nullable": false,
          "null_count": 0,
          "non_null_count": 29223,
          "type_violations": 0,
          "range_violations": 0,
          "bounds": {
            "kind": "numeric-inclusive",
            "minimum": 0,
            "maximum": 20
          },
          "change_policy": "schema-version-bump-and-full-revalidation"
        },
        {
          "id": "c0006",
          "source_ordinal": 6,
          "source_name": "color",
          "type": "int64",
          "nullable": false,
          "null_count": 0,
          "non_null_count": 29223,
          "type_violations": 0,
          "range_violations": 0,
          "bounds": {
            "kind": "numeric-inclusive",
            "minimum": 1,
            "maximum": 10
          },
          "change_policy": "schema-version-bump-and-full-revalidation"
        },
        {
          "id": "c0007",
          "source_ordinal": 7,
          "source_name": "capacity",
          "type": "int64",
          "nullable": true,
          "null_count": 1032,
          "non_null_count": 28191,
          "type_violations": 0,
          "range_violations": 0,
          "bounds": {
            "kind": "numeric-inclusive",
            "minimum": 0,
            "maximum": 20
          },
          "change_policy": "schema-version-bump-and-full-revalidation"
        },
        {
          "id": "c0008",
          "source_ordinal": 8,
          "source_name": "binding_type",
          "type": "string",
          "nullable": false,
          "null_count": 0,
          "non_null_count": 29223,
          "type_violations": 0,
          "range_violations": 0,
          "bounds": {
            "kind": "utf8-byte-length-inclusive",
            "minimum_utf8_bytes": 7,
            "maximum_utf8_bytes": 9
          },
          "change_policy": "schema-version-bump-and-full-revalidation"
        },
        {
          "id": "c0009",
          "source_ordinal": 9,
          "source_name": "two-hands",
          "type": "string",
          "nullable": true,
          "null_count": 28456,
          "non_null_count": 767,
          "type_violations": 0,
          "range_violations": 0,
          "bounds": {
            "kind": "utf8-byte-length-inclusive",
            "minimum_utf8_bytes": 4,
            "maximum_utf8_bytes": 4
          },
          "change_policy": "schema-version-bump-and-full-revalidation"
        },
        {
          "id": "c0010",
          "source_ordinal": 10,
          "source_name": "buy_price",
          "type": "int64",
          "nullable": true,
          "null_count": 2707,
          "non_null_count": 26516,
          "type_violations": 0,
          "range_violations": 0,
          "bounds": {
            "kind": "numeric-inclusive",
            "minimum": 0,
            "maximum": 300000000
          },
          "change_policy": "schema-version-bump-and-full-revalidation"
        },
        {
          "id": "c0011",
          "source_ordinal": 11,
          "source_name": "buy_honor",
          "type": "int64",
          "nullable": true,
          "null_count": 27381,
          "non_null_count": 1842,
          "type_violations": 0,
          "range_violations": 0,
          "bounds": {
            "kind": "numeric-inclusive",
            "minimum": 0,
            "maximum": 60
          },
          "change_policy": "schema-version-bump-and-full-revalidation"
        },
        {
          "id": "c0012",
          "source_ordinal": 12,
          "source_name": "buy_gc",
          "type": "int64",
          "nullable": true,
          "null_count": 26969,
          "non_null_count": 2254,
          "type_violations": 0,
          "range_violations": 0,
          "bounds": {
            "kind": "numeric-inclusive",
            "minimum": 0,
            "maximum": 1200000
          },
          "change_policy": "schema-version-bump-and-full-revalidation"
        },
        {
          "id": "c0013",
          "source_ordinal": 13,
          "source_name": "buy_camp",
          "type": "int64",
          "nullable": true,
          "null_count": 28755,
          "non_null_count": 468,
          "type_violations": 0,
          "range_violations": 0,
          "bounds": {
            "kind": "numeric-inclusive",
            "minimum": 28,
            "maximum": 29
          },
          "change_policy": "schema-version-bump-and-full-revalidation"
        },
        {
          "id": "c0014",
          "source_ordinal": 14,
          "source_name": "buy_campvalue",
          "type": "int64",
          "nullable": true,
          "null_count": 28252,
          "non_null_count": 971,
          "type_violations": 0,
          "range_violations": 0,
          "bounds": {
            "kind": "numeric-inclusive",
            "minimum": 0,
            "maximum": 960000
          },
          "change_policy": "schema-version-bump-and-full-revalidation"
        },
        {
          "id": "c0015",
          "source_ordinal": 15,
          "source_name": "buy_camprank",
          "type": "int64",
          "nullable": true,
          "null_count": 28266,
          "non_null_count": 957,
          "type_violations": 0,
          "range_violations": 0,
          "bounds": {
            "kind": "numeric-inclusive",
            "minimum": 0,
            "maximum": 10
          },
          "change_policy": "schema-version-bump-and-full-revalidation"
        },
        {
          "id": "c0016",
          "source_ordinal": 16,
          "source_name": "gc_reputations",
          "type": "int64",
          "nullable": true,
          "null_count": 29174,
          "non_null_count": 49,